key,en_us
advancement.gm4.spawner_minecarts.title,Don't Go Breaking My Cart
advancement.gm4.spawner_minecarts.description,Capture a Monster Spawner
text.gm4.guidebook.module_desc.spawner_minecarts,Pick up Spawners and move them wherever you want with Minecarts.
text.gm4.guidebook.spawner_minecarts.description,Spawners can be picked up with Minecarts.\n\nOnce a spawner is in a minecart it cannot be ejected and has reduced spawn rates for all carts within a 9x8x9 area around the spawner.
text.gm4.guidebook.spawner_minecarts.pick_up,"To capture a spawner, place a minecart under it, then a downwards piston above the spawner, and finally a redstone block above the piston."
