key,en_us,de_de
item.gm4.bat_leather,Bat Leather,Fledermausleder
text.gm4.bat_leather.1,"Would make for a very strange,","Würde eine ziemlich merkwürde,"
text.gm4.bat_leather.2,very tiny jacket,ziemlich kleine Jacke ergeben
advancement.gm4.bat_grenades.title,Batboozled,
advancement.gm4.bat_grenades.description,Get blown up by a Bat Grenade,
text.gm4.guidebook.module_desc.bat_grenades,Tired of the uselessness of bats? This module will turn them into tiny furry flying balls of boom!,
text.gm4.guidebook.bat_grenades.description,"Bats create a weak explosion when nearby.\n\nWhen killed, bats will drop gunpowder and bat leather—a material equivalent to rabbit hide.",
